imageid,text,l1_l4_vector_unweighted,l1_l4_vector_weighted,keyword_vector_unweighted,keyword_vector_weighted,lx,ly,kx,ky,sx,sy
1576,"Figure 6.4. The concentrations and radiative forcing by (a) CO2, (b) CH4 and (c) nitrous oxide (N2O), and (d) the rate of change in their combined radiative forcing over the  last 20 kyr reconstructed from antarctic and Greenland ice and fi rn data (symbols) and direct atmospheric measurements (red and magenta lines). The grey bars show the  reconstructed ranges of natural variability for the past 650 kyr (Siegenthaler et al., 2005a; Spahni et al., 2005). Radiative forcing was computed with the simplifi ed expres- sions of Chapter 2 (Myhre et al., 1998). The rate of change in radiative forcing (black line) was computed from spline fi ts (Enting, 1987) of the concentration data (black lines  in panels a to c). The width of the age distribution of the bubbles in ice varies from about 20 years for sites with a high accumulation of snow such as Law Dome, Antarctica, to  about 200 years for low-accumulation sites such as Dome C, Antarctica. The Law Dome ice and fi rn data, covering the past two millennia, and recent instrumental data have  been splined with a cut-off period of 40 years, with the resulting rate of change in radiative forcing shown by the inset in (d). The arrow shows the peak in the rate of change in  radiative forcing after the anthropogenic signals of CO2, CH4 and N2O have been smoothed with a model describing the enclosure process of air in ice (Spahni et al., 2003) ap- plied for conditions at the low accumulation Dome C site for the last glacial transition. The CO2 data are from Etheridge et al. (1996); Monnin et al. (2001); Monnin et al. (2004);  Siegenthaler et al. (2005b; South Pole); Siegenthaler et al. (2005a; Kohnen Station); and MacFarling Meure et al. (2006). The CH4 data are from Stauffer et al. (1985); Steele et al.  (1992); Blunier et al. (1993); Dlugokencky et al. (1994); Blunier et al. (1995); Chappellaz et al. (1997); Monnin et al. (2001); Fluckiger et al. (2002); and Ferretti et al. (2005). The  N2O data are from Machida et al. (1995); Battle et al. (1996); Fluckiger et al. (1999, 2002); and MacFarling Meure et al. (2006). Atmospheric data are from the National Oceanic  and Atmospheric Administration's global air sampling network, representing global average concentrations (dry air mole fraction; Steele et al., 1992; Dlugokencky et al., 1994;  Tans and Conway, 2005), and from Mauna Loa, Hawaii (Keeling and Whorf, 2005). The globally averaged data are available from http://www.cmdl.noaa.gov/.","[1, 2, 1.0, 7.0]","[1, 2, 80, 560]","[0.08, 0.01, 0.06, 0, 12.0, 12.0]","[8, 1, 6, 0, 1200, 1200]",9.778607,2.6210206,-3.5366907,6.8677707,2.0614161,0.30258855
332,"Figure 7.23 | Estimated levelized cost of on- and offshore wind energy, 2009: (left) as a function of capacity factor and investment cost* and (right) as a function of capacity factor  and discount rate**. ","[1, 0, 0, 0]","[1, 0, 0, 0]","[0, 0, 0.02, 0, 1.0, 2.0]","[0, 0, 2, 0, 100, 200]",-10.275958,-5.184355,9.114157,-6.16728,6.3762684,-16.018997
1246,"Figure 11.7: Time-series of relative sea level for the past 300 years from Northern Europe: Amsterdam, Netherlands; Brest, France; Sheerness, UK; Stockholm, Sweden (detrended over the period 1774 to 1873 to remove to first order the contribution of postglacial rebound); Swinoujscie, Poland (formerly Swinemunde, Germany); and Liverpool, UK. Data for the latter are of 'Adjusted Mean High Water' rather than Mean Sea Level and include a nodal (18.6 year) term. The scale bar indicates +-100 mm. (Adapted from Woodworth, 1999a.)","[1, 1, 0, 2.0]","[1, 1, 0, 160]","[0.03, 0, 0.05, 0, 5.0, 2.0]","[3, 0, 5, 0, 500, 200]",6.605845,8.874579,7.200201,2.4378533,-8.508964,11.195571
1087,"Figure 5.13. Annual averages of the global mean sea level (mm). The red curve shows reconstructed  sea level fi elds since 1870 (updated from Church and White, 2006); the blue curve shows coastal tide  gauge measurements since 1950 (from Holgate and Woodworth, 2004) and the black curve is based  on satellite altimetry (Leuliette et al., 2004). The red and blue curves are deviations from their averages  for 1961 to 1990, and the black curve is the deviation from the average of the red curve for the period  1993 to 2001. Error bars show 90% confi dence intervals. ","[2, 2, 0, 0]","[2, 2, 0, 0]","[0.03, 0.02, 0.04, 0, 5.0, 9.0]","[3, 2, 4, 0, 500, 900]",-10.277158,-5.1841493,-4.2843213,0.13015768,-6.8625484,11.6437645
1510,"Figure 6.10. Causes, selected consequences (dryland and wetland loss, people displaced) and the total costs of an assumed sea-level rise, for developing and developed countries, and as a global total. (based on Tol, 2007).","[0, 0, 1.0, 1.0]","[0, 0, 80, 80]","[0.03, 0, 0.01, 0, 2.0, 1.0]","[3, 0, 1, 0, 200, 100]",-4.8964195,0.751997,10.840431,-4.0892625,-8.362855,8.127056
2215,"Figure 12.2: (a) The relationship between peak global mean temperature, atmospheric CO2, maximum global mean  sea level (GMSL), and source(s) of meltwater for two periods in the past with global mean temperature comparable to  or warmer than present. Light blue shading indicates uncertainty of GMSL maximum. Red pie charts over Greenland  and Antarctica denote fraction, not location, of ice retreat. Atmospheric CO2 levels in 2100 are shown under RCP8.5. (b)  GMSL rise from -500 to 1900 CE, from Kopp et al.'s32 geological and tide gauge-based reconstruction (blue), from 1900  to 2010 from Hay et al.'s33 tide gauge-based reconstruction (black), and from 1992 to 2015 from the satellite-based  reconstruction updated from Nerem et al.35 (magenta). (Figure source: (a) adapted from Dutton et al. 201520 and (b)  Sweet et al. 201771).","[4, 1, 0, 1.0]","[4, 1, 0, 80]","[0.03, 0.01, 0.08, 0, 3.0, 5.0]","[3, 1, 8, 0, 300, 500]",-13.209369,-1.7836682,2.138118,-2.3362098,-5.8970375,8.937347
1146,"Figure 7.21. Global mean total anthropogenic aerosol effect (direct, semi-direct and indirect cloud albedo and lifetime effects) defi ned as the response in net radiation at TOA  from pre-industrial times to the present day and its contribution over the NH and SH, over oceans and over land, and the ratio over oceans/land. Red bars refer to anthropogenic  sulphate (Easter et al., 2004; Ming et al., 2005+), green bars refer to anthropogenic sulphate and black carbon (Kristjansson, 2002*,+), blue bars to anthropogenic sulphate and  organic carbon (Quaas et al., 2004; Rotstayn and Liu, 2005+), cyan bars to anthropogenic sulphate and black and organic carbon (Menon and Del Genio, 2005; Takemura et al.,  2005; Johns et al., 2006; Storelvmo et al., 2006), dark purple bars to anthropogenic sulphate and black and organic carbon effects on water and ice clouds (Jacobson, 2006;  Lohmann and Diehl, 2006), teal bars refer to a combination of GCM and satellite results (European Centre for Medium Range Weather Forecasts/Max-Planck Institute for Meteo- rology Atmospheric GCM (ECHAM) plus Polarisation and Directionality of the Earth's Refl ectance (POLDER), Lohmann and Lesins, 2002; Laboratoire de Meteorologie Dynamique  GCM (LMDZ)/ECHAM plus Moderate Resolution Imaging Spectroradiometer (MODIS), Quaas et al., 2006) and olive bars to the mean and standard deviation from all simulations.  Vertical black lines for individual results refer to +-1 standard deviation in cases of multiple simulations and/or results.","[1, 0, 0, 2.0]","[1, 0, 0, 160]","[0.04, 0.03, 0.05, 0.02, 2.0, 17.0]","[4, 3, 5, 2, 200, 1700]",7.0609393,8.843563,-9.938765,1.8050686,7.81729,7.374155
1711,"Figure 6.8: Time evolution of global mean radiative forcing from pre-industrial times (1750) to present. Annual mean radiative forcing values are shown, except for stratospheric aerosols of volcanic origin where a three-year running mean is used. Radiative forcings due to (a) well-mixed greenhouse gases, tropospheric O3, and stratospheric O3, (b) direct effect of sulphate aerosols, fossil fuel organic and black carbon aerosols, and biomass burning aerosols, (c) solar irradiance variations from Lean et al. (1995) and Hoyt and Schatten (1993), respectively, and (d) stratospheric aerosols of volcanic origin from Sato et al. (1993) (and updated with data from www.giss.nasa.gov) for the period 1850 to 1998 and from Robock and Free (1996) for the period 1750 to 1988 (for the Northern Hemisphere only). Note the change of scales in the different panels.","[2, 1, 0, 1.0]","[2, 1, 0, 80]","[0.05, 0, 0.04, 0, 4.0, 2.0]","[5, 0, 4, 0, 400, 200]",-13.48645,-1.4007957,8.374366,1.2959988,2.4848979,4.361523
1388,"Figure 6.3 Equilibrium partitioning of CO2 between the ocean and  atmosphere. On the time scale of millennia, complete mixing of the  oceans leads to a partitioning of cumulative CO2 emissions between the  oceans and atmosphere with the bulk of emissions eventually residing in  the oceans as dissolved inorganic carbon. The ocean partition depends  nonlinearly on CO2 concentration according to carbonate chemical  equilibrium (Box 6.1) and has limited sensitivity to changes in surface  water temperature (shown by the grey area for a range of climate  sensitivity of 1.5 to 4.5degC for CO2 doubling) (adapted from Kheshgi  et al., 2005; Kheshgi, 2004a). pH evaluated from pCO2 of 275 ppm.  This calculation is relevant on the time scale of several centuries, and  does not consider changes in ocean alkalinity that increase ocean CO2  uptake over several millennia (Archer et al., 1997).","[1, 0, 2.0, 2.0]","[1, 0, 160, 160]","[0.01, 0.01, 0.03, 0, 6.0, 3.0]","[1, 1, 3, 0, 600, 300]",3.5905583,-0.2540734,4.8975034,3.8049643,-1.704473,-7.6218667
2348,"Figure 2.3. Atmospheric concentrations of CO2, CH4 and N2O over the last 10,000 years (large panels) and since 1750 (inset panels). Measurements are shown from ice cores (symbols with different colours for different stud- ies) and atmospheric samples (red lines). The corresponding radiative forcings relative to 1750 are shown on the right hand axes of the large panels. {WGI Figure SPM.1}","[3, 0, 0, 1.0]","[3, 0, 0, 80]","[0.01, 0, 0.02, 0, 4.0, 6.0]","[1, 0, 2, 0, 400, 600]",-14.368307,-1.7979615,0.71017414,-0.2982249,1.6864591,-1.2063055
736,"Figure 5.7 Radial simulations of CO2 injection into a homogeneous formation 100 m thick, at a depth of 1 km, where the pressure is 10 MPa and  the temperature is 40degC. The injection rate is 1 MtCO2 yr-1 for 20 years, the horizontal permeability is 10 -13 m2 (approximately 100 mD) and the  vertical permeability is one-tenth of that. The residual CO2 saturation is 20%. The first three parts of the figure at 2, 20 and 200 years, show the  gas saturation in the porous medium; the second three parts of the figure at 200, 2000 and 4000 years, show the mass fraction of dissolved CO2  in the aqueous phase (after Ennis-King and Paterson, 2003).","[1, 2, 0, 1.0]","[1, 2, 0, 80]","[0.03, 0, 0.05, 0.01, 2.0, 3.0]","[3, 0, 5, 1, 200, 300]",-13.671572,-1.2897421,6.5180316,-4.2845364,-3.3859446,-8.296993
2060,"Figure 9.4: Intercomparison statistics for seasonal and annual (a) temperature and (b) precipitation changes in nineteen CMIP2 experiments at the doubling of CO2 (years 61 to 80). The total length of the bars shows the mean squared amplitude of the simulated local temperature and precipita- tion changes averaged over all experiments and over the whole world. The lowermost part of each bar represents a nominally unbiased 'common signal', the mid-part directly model-related variance and the top part the inter-experiment variance attributed to internal variability. Precipitation changes are defined as 100% x (PG the global statistics to areas with very little control run precipitation.","[2, 2, 0, 0]","[2, 2, 0, 0]","[0.05, 0, 0.11, 0, 7.0, 3.0]","[5, 0, 11, 0, 700, 300]",-10.277158,-5.1841493,4.3400807,5.058634,-4.4799323,0.71332115
1251,Figure 7.8: Projected change (percentage change relative to the 1976-2005 reference period average) in the number  of daily zero ('No-Precip') and non-zero precipitation days (by percentile bins) for late-21st century under a higher  scenario (RCP8.5). The precipitation percentile bin thresholds are based on daily non-zero precipitation amounts from  the 1976-2005 reference period that have been ranked from low to high. These results are calculated from the LOCA  downscaled data. (Figure source: CICS-NC and NOAA NCEI).,"[0, 0, 2.0, 2.0]","[0, 0, 160, 160]","[0.06, 0.02, 0.06, 0, 7.0, 1.0]","[6, 2, 6, 0, 700, 100]",2.8609133,-0.6018652,6.078199,5.5081425,-12.98817,4.7064624
1112,"Figure 3.2: Comparison of GDP projections in post-SRES emissions scenarios  with those used in previous scenarios. The median of the new scenarios is about 7%  below the median of the pre-SRES and SRES scenario literature. The two vertical  bars on the right extend from the minimum to maximum of the distribution of  scenarios by 2100. The horizontal bars indicate the 5th, 25th, 50th, 75th and the 95th  percentiles of the distributions.","[2, 1, 0, 1.0]","[2, 1, 0, 80]","[0, 0, 0.06, 0.02, 2.0, 5.0]","[0, 0, 6, 2, 200, 500]",-13.48645,-1.4007957,1.79839,-3.8620982,10.111184,-10.08907
1601,"Figure 6.13 Volume of water with a pH less than the value shown  on the horizontal axis for the simulations shown in Figure 6.12  corresponding to CO2 releases from a 500 MWe power plant. The fixed  pipe simulation produces a region with pH < -1, however, the moving  ship disperses the CO2 more widely, largely avoiding pH changes of  this magnitude.","[0, 0, 1.0, 1.0]","[0, 0, 80, 80]","[0.01, 0, 0.02, 0.02, 3.0, 2.0]","[1, 0, 2, 2, 300, 200]",-4.5234075,-0.36903602,8.787615,-1.35801,-0.83938235,-10.14908
1715,"Figure 2.23 | (a) The global primary energy supply from biomass in long-term scenarios; (b) global biofuels production in long-term scenarios reported in secondary energy terms of  the delivered product (median, 25th to 75th percentile range and full range of scenario results; colour coding is based on categories of atmospheric CO2 concentration levels in 2100;  the number of scenarios underlying the fi gure is indicated in the right upper corner) (adapted from Krey and Clarke, 2011). For comparison, the historic levels in 2008 are indicated  by the small black arrows on the left axis. ","[1, 1, 0, 0]","[1, 1, 0, 0]","[0.02, 0.03, 0.04, 0.01, 1.0, 6.0]","[2, 3, 4, 1, 100, 600]",-10.275988,-5.1844606,0.1799776,-5.0909944,11.322999,-3.999189
2251,"Figure 4.14: Atmospheric composition and properties predicted using the six SRES Marker-Illustrative scenarios for anthropogenic emissions: A1B (green dashed line), A1T (yellow dash-dotted), A1FI (orange dash-dot-dotted), A2 (red solid), B1 (cyan dashed), B2 (solid dark blue). Abundances prior to year 2000 are taken from observations, and the IS92a scenario computed with current methodology is shown for reference (thin black line). Results are shown for CH4 (ppb), N2O (ppb), tropospheric O3 (DU), HFC-134a (ppt), CF4 (ppt), SF6 (ppt), the lifetime of CH4 (yr), and the global annual mean abundance of tropospheric OH (scaled to year 2000 value). All SRES A1-type scenarios have the same emissions for HFCs, PFCs, and SF6 (appearing a A1B), but the HFC-134a abundances vary because the tropospheric OH values differ affecting its lifetime. The IS92a scenario did not include emissions of PFCs and SF6. For details, see chapter text and tables in Appendix II.","[2, 1, 0, 3.0]","[2, 1, 0, 240]","[0.04, 0, 0.05, 0.01, 3.0, 14.0]","[4, 0, 5, 1, 300, 1400]",8.317785,5.9703374,-8.736427,1.1264838,8.163763,2.769316
1177,"Figure 11.7: Time-series of relative sea level for the past 300 years from Northern Europe: Amsterdam, Netherlands; Brest, France; Sheerness, UK; Stockholm, Sweden (detrended over the period 1774 to 1873 to remove to first order the contribution of postglacial rebound); Swinoujscie, Poland (formerly Swinemunde, Germany); and Liverpool, UK. Data for the latter are of 'Adjusted Mean High Water' rather than Mean Sea Level and include a nodal (18.6 year) term. The scale bar indicates +-100 mm. (Adapted from Woodworth, 1999a.)","[1, 1, 0, 2.0]","[1, 1, 0, 160]","[0.03, 0, 0.05, 0, 5.0, 2.0]","[3, 0, 5, 0, 500, 200]",6.462012,9.015896,7.464723,2.528896,-8.508964,11.195571
1874,"Figure 3.4: Partitioning of fossil fuel CO2 uptake using O2 measurements (Keeling and Shertz, 1992; Keeling et al., 1993; Battle et al., 1996, 2000; Bender et al., 1996; Keeling et al., 1996b; Manning, 2001). The graph shows the relationship between changes in CO2 (horizontal axis) and O2 (vertical axis). Observations of annual mean concentrations of O2, centred on January 1, are shown from the average of the Alert and La Jolla monitoring stations (Keeling et al., 1996b; Manning, 2001; solid circles) and from the average of the Cape Grim and Point Barrow monitoring stations (Battle et al., 2000; solid triangles). The records from the two laboratories, which use different reference standards, have been shifted to optimally match during the mutually overlapping period. The CO2 observations represent global averages compiled from the stations of the NOAA network (Conway et al., 1994) with the methods of Tans et al. (1989). The arrow labelled 'fossil fuel burning' denotes the effect of the combustion of fossil fuels (Marland et al., 2000; British Petroleum, 2000) based on the relatively well known O2:CO2 stoichiometric relation of the different fuel types (Keeling, 1988). Uptake by land and ocean is constrained by the known O2:CO2 stoichiometric ratio of these processes, defining the slopes of the respective arrows. A small correction is made for differential outgassing of O2 and N2 with the increased temperature of the ocean as estimated by Levitus et al. (2000). ","[2, 2, 0, 4.0]","[2, 2, 0, 320]","[0.03, 0, 0.06, 0.02, 5.0, 9.0]","[3, 0, 6, 2, 500, 900]",9.225872,4.6536765,-4.284624,0.13053463,1.6689714,-6.020196
1499,"Figure 10.2: Anthropogenic radiative forcing (RF) contributions, separated by land-use and land-cover change (LUL- CC) and non-LULCC sources (green and maroon bars, respectively), are decomposed by atmospheric constituent to  year 2010 in this diagram, using the year 1850 as the reference. Total anthropogenic RF contributions by atmospheric  constituent4 (see also Figure 2.3) are shown for comparison (yellow bars). Error bars represent uncertainties for total  anthropogenic RF (yellow bars) and for the LULCC components (green bars).5 The SUM bars indicate the net RF when  all anthropogenic forcing agents are combined. (Figure source: Ward et al. 20145).","[3, 0, 0, 2.0]","[3, 0, 0, 160]","[0.05, 0.01, 0.02, 0.01, 4.0, 9.0]","[5, 1, 2, 1, 400, 900]",7.3950057,9.320009,-4.5193543,-0.76491463,6.6547604,7.1304817
1301,"Figure 2.10 | Accounting of cumulative CO2 emissions for the four 1.5degC-consistent pathway archetypes. See top panel for explanation of the bar plots. Total  CDR is the difference between gross (red horizontal bar) and net (purple horizontal bar) cumulative CO2 emissions over the period 2018-2100, and it is equal to the sum of the  BECCS (grey) and AFOLU CDR (green) contributions. Cumulative net negative emissions are the difference between peak (orange horizontal bar) and net (purple) cumulative CO2  emissions. The blue shaded area depicts the estimated range of the remaining carbon budget for a two-in-three to one-in-two chance of staying below1.5degC. The grey shaded  area depicts the range when accounting for additional Earth system feedbacks. ","[4, 1, 0, 1.0]","[4, 1, 0, 80]","[0.06, 0.02, 0.1, 0, 4.0, 22.0]","[6, 2, 10, 0, 400, 2200]",-13.203132,-1.9595976,-10.165976,4.014027,7.1994066,-7.577622
2061,"Figure 8.14 | Relative fuel economies of future alternative drive train light duty vehicles  compared to advanced spark ignition, gasoline-fuelled, internal-combustion engine vehicles,  based on several selected studies.","[0, 0, 0, 1.0]","[0, 0, 0, 80]","[0, 0, 0.01, 0.02, 1.0, 1.0]","[0, 0, 1, 2, 100, 100]",-14.118841,-2.4114766,10.478039,-5.8312507,9.316987,-15.407354
188,"Figure 3.14: Total black carbon (left panel) and organic carbon (right panel) emission estimates in scenarios from different studies.  Notes: Rao et al., (2005) include emissions from contained combustion only. Liousse et al. (2005), A2 not included as 2100 value of 100 Tg lies way above range.","[0, 0, 2.0, 1.0]","[0, 0, 160, 80]","[0.01, 0.02, 0.01, 0, 1.0, 5.0]","[1, 2, 1, 0, 100, 500]",0.086998664,-2.9573627,1.5221764,-5.0900555,6.418507,-6.803891
1143,"Figure 6.5: Reconstructions of total solar irradiance (TSI) by Lean et al. (1995, solid red curve), Hoyt and Schatten (1993, data updated by the authors to 1999, solid black curve), Solanki and Fligge (1998, dotted blue curves), and Lockwood and Stamper (1999, heavy dash- dot green curve); the grey curve shows group sunspot numbers (Hoyt and Schatten, 1998) scaled to Nimbus-7 observations for 1979 to 1993.","[0, 0, 0, 1.0]","[0, 0, 0, 80]","[0.01, 0, 0, 0.01, 4.0, 8.0]","[1, 0, 0, 1, 400, 800]",-14.062162,-1.3545421,-3.4153347,-0.94392467,4.228616,16.157278
1068,"Figure 2.13: The 76 post-SRES stabilization scenarios of world fossil fuel CO2 emissions. Different stabilization levels are indi- cated by colour, with 750ppmv in red, 650ppmv in black, 550ppmv in blue, and 450ppmv in green. For comparison, the minimum and maximum of the ranges of scenarios from the literature (grey) and the SRES (yellow) as well as the WRI and WRE 550ppmv stabilization scenarios (bold black) are also shown.","[2, 0, 1.0, 0]","[2, 0, 80, 0]","[0, 0.01, 0.02, 0.01, 4.0, 8.0]","[0, 1, 2, 1, 400, 800]",-5.358941,-5.535961,-3.415366,-0.9440443,6.8103,-4.265238
658,"Figure 3.20 | Expected cost decline for CSP plants from 2012 to 2025. The cost number includes the cost of the plant plus fi nancing (A.T. Kearney, 2010). As reduction ranges for cost,  effi ciency and economies of scale in the right panel overlap, their total contribution in 2025 amounts to less than their overall total.","[1, 1, 1.0, 0]","[1, 1, 80, 0]","[0.02, 0.01, 0.01, 0, 4.0, 2.0]","[2, 1, 1, 0, 400, 200]",-5.379036,-6.0020027,7.858285,1.1037205,13.81319,-7.306225
1779,"Figure 2-4: Simulating the Earth's temperature variations and comparing the results to the measured changes can provide insight into the underlying causes of the major changes. A climate model can be used to simulate the temperature changes that occur from both natural and anthropogenic causes. The simulations represented by the band in (a) were done with only natural forcings: solar variation and volcanic activity. Those encompassed by the band in (b) were done with anthropogenic forcings: greenhouse gases and an estimate of sulfate aerosols. Those encompassed by the band in (c) were done with both natural and anthropogenic forcings included. From (b), it can be seen that the inclusion of anthropogenic forcings provides a plausible explanation for a substantial part of the observed temperature changes over the past century, but the best match with observations is obtained in (c) when both natural and anthropogenic factors are included. These results show that the forcings included are sufficient to explain the observed changes, but do not exclude the possibility that other forcings may also have contributed. Similar results to those in (b) are obtained with other models with anthropogenic forcing.","[3, 0, 3.0, 2.0]","[3, 0, 240, 160]","[0.01, 0.01, 0.02, 0.03, 8.0, 3.0]","[1, 1, 2, 3, 800, 300]",4.4275775,-2.5342138,3.7280076,6.105094,-0.7983648,7.075066
2194,"Figure 2.13: (a) Anomalies of monthly snow cover over the Northern Hemisphere lands (including Greenland) between November 1966 and May 2000. Also shown are twelve-month running anomalies of hemispheric snow extent, plotted on the seventh month of a given interval. Anomalies are calculated from NOAA/NESDIS snow maps. Mean hemispheric snow extent is 25.2 million km2 for the full period of record. the curve of running means is extrapolated by using period of record monthly means for 12 months in the late 1960s in order to create a continuous curve of running means. Missing months fell between May and October, and no winter months are missing. June 1999 to May 2000 values are based on preliminary analyses. (b) Seasonal snowcover anomalies (in million km2) versus temperature anomalies (in degC). Both snow and temperature anomalies are area averages over the region for which climatological values of seasonal snow-cover frequency (based on the 1973 to 1998 period) are between 10 and 90%. Season is indicated at the top of each panel. Axis for snow anomaly on the left-hand-side y axis, axis for temperature anomaly is on the right-hand-side y axis. Bar plot indicates time-series of snow cover anomalies. Continuous colour curve indicates nine-point weighted average of snow-cover anomaly. Dashed black curve indicates time-series of nine-point weighted average of area average temperature anomaly. Snow-cover calculations are based on the NOAA/NESDIS snow cover data for the period 1973 to 1998 (updated from Robinson et al., 1993). Temperature calculations are based on the Jones data set, hence anomalies are with respect to the time period 1961 to 1990. Snow anomalies are with respect to the time period 1973 to 1998. Correlation coefficient (r) between seasonal snow cover anomalies and temperature anomalies is indicated in parentheses. (Figure contributed by David A. Robinson and Anjuli Bamzai, Rutgers University.)","[7, 2, 4.0, 5.0]","[7, 2, 320, 400]","[0.19, 0.16, 0.14, 0, 5.0, 19.0]","[19, 16, 14, 0, 500, 1900]",8.583812,-1.9910048,-9.658944,3.3826208,-12.800515,10.312763
