imageid,text,l1_l4_vector_unweighted,l1_l4_vector_weighted,keyword_vector_unweighted,keyword_vector_weighted,lx,ly,kx,ky,sx,sy
2064,"Figure 6.1. (Top) Atmospheric CO2 and continental glaciation 400 Ma to present. Vertical blue bars mark the timing and palaeolatitudinal extent of ice sheets (after Crowley,  1998). Plotted CO2 records represent fi ve-point running averages from each of the four major proxies (see Royer, 2006 for details of compilation). Also plotted are the plausible  ranges of CO2 from the geochemical carbon cycle model GEOCARB III (Berner and Kothavala, 2001). All data have been adjusted to the Gradstein et al. (2004) time scale.  (Middle) Global compilation of deep-sea benthic foraminifera 18O isotope records from 40 Deep Sea Drilling Program and Ocean Drilling Program sites (Zachos et al., 2001)  updated with high-resolution records for the Eocene through Miocene interval (Billups et al., 2002; Bohaty and Zachos, 2003; Lear et al., 2004). Most data were derived from  analyses of two common and long-lived benthic taxa, Cibicidoides and Nuttallides. To correct for genus-specifi c isotope vital effects, the 18O values were adjusted by +0.64 and  +0.4 (Shackleton et al., 1984), respectively. The ages are relative to the geomagnetic polarity time scale of Berggren et al. (1995). The raw data were smoothed using a fi ve- point running mean, and curve-fi tted with a locally weighted mean. The 18O temperature values assume an ice-free ocean (-1.0%0 Standard Mean Ocean Water), and thus only  apply to the time preceding large-scale antarctic glaciation (~35 Ma). After the early Oligocene much of the variability (~70%) in the 18O record refl ects changes in antarctic and  Northern Hemisphere ice volume, which is represented by light blue horizontal bars (e.g., Hambrey et al., 1991; Wise et al., 1991; Ehrmann and Mackensen, 1992). Where the  bars are dashed, they represent periods of ephemeral ice or ice sheets smaller than present, while the solid bars represent ice sheets of modern or greater size. The evolution  and stability of the West Antarctic Ice Sheet (e.g., Lemasurier and Rocchi, 2005) remains an important area of uncertainty that could affect estimates of future sea level rise.  (Bottom) Detailed record of CO2 for the last 65 Myr. Individual records of CO2 and associated errors are colour-coded by proxy method; when possible, records are based on  replicate samples (see Royer, 2006 for details and data references). Dating errors are typically less than +-1 Myr. The range of error for each CO2 proxy varies considerably, with  estimates based on soil nodules yielding the greatest uncertainty. Also plotted are the plausible ranges of CO2 from three geochemical carbon cycle models.","[0, 1, 12.0, 4.0]","[0, 1, 960, 320]","[0.05, 0.08, 0.12, 0.01, 17.0, 17.0]","[5, 8, 12, 1, 1700, 1700]",6.4773636,-4.89883,-4.9296927,7.63224,-0.43196112,-4.9024262
1215,"Figure 4.4 | Change in annual investment flows from the average baseline level over the next two decades (2010 to 2029) for mitigation scenarios that stabilize concentrations  (without overshoot) within the range of approximately 430 to 530 ppm CO2-eq by 2100. Total electricity generation (leftmost column) is the sum of renewable and nuclear energy,  power plants with CCS, and fossil-fuel power plants without CCS. The vertical bars indicate the range between the minimum and maximum estimate; the horizontal bar indicates  the median. The numbers in the bottom row show the total number of studies in the literature used in the assessment. Individual technologies shown are found to be used in dif- ferent model scenarios in either a complementary or a synergistic way, depending largely on technology-specific assumptions and the timing and ambition level of the phase-in of  global climate policies. {WGIII Figure SPM.9}","[0, 2, 2.0, 2.0]","[0, 2, 160, 160]","[0.05, 0.03, 0.09, 0, 3.0, 5.0]","[5, 3, 9, 0, 300, 500]",2.8135066,-0.3129631,2.139335,-2.3355205,12.211445,-9.16349
937,"Figure 11.19. Annual cycle of arctic area  mean temperature and percentage precipi- tation changes (averaged over the area north  of 60degN) for 2080 to 2099 minus 1980 to  1999, under the A1B scenario. Thick lines  represent the ensemble median of the 21  MMD models. The dark grey area represents  the 25 and 75% quartile values among the  21 models, while the light grey area shows  the total range of the models.","[2, 0, 0, 1.0]","[2, 0, 0, 80]","[0.03, 0.02, 0.04, 0, 3.0, 8.0]","[3, 2, 4, 0, 300, 800]",-14.265847,-1.5370629,-3.385876,-1.9734573,-11.515522,14.021099
152,"Figure 1.3 | Left panel: Projected increase in primary energy supply. Comparison of 153 SRES and pre-SRES baseline energy scenarios in the literature compared with the 133 more  recent, post-SRES scenarios. The ranges are comparable, with small changes in the lower and upper boundaries. Right panel: Expected carbon intensity changes. Historical development  and projections from SRES and pre-SRES scenarios compared to post-SRES scenarios. Adapted from Fisher et al., 2007, pp. 183 and 184.","[0, 0, 3.0, 3.0]","[0, 0, 240, 240]","[0.01, 0.01, 0.01, 0.04, 7.0, 6.0]","[1, 1, 1, 4, 700, 600]",6.59583,-1.9066489,0.51038426,3.8550851,10.974679,-10.945393
436,"Figure 4.9. Summer minimum arctic sea ice extent from 1979 to 2005. Symbols  indicate annual mean values while the smooth blue curve shows decadal variations  (see Appendix 3.A). The dashed line indicates the linear trend, which is -60 +-  20 x 103 km2 yr-1, or approximately -7.4% per decade (updated from Comiso,  2002).","[2, 1, 0, 0]","[2, 1, 0, 0]","[0.03, 0, 0.02, 0, 6.0, 3.0]","[3, 0, 2, 0, 600, 300]",-10.27691,-5.1839695,4.89692,3.8043368,-10.945519,13.24531
1790,"Figure 7.6: Regional extreme precipitation event frequency for a lower scenario (RCP4.5) (green; 16 CMIP5 models)  and the higher scenario (RCP8.5) (blue; 14 CMIP5 models) for a 2-day duration and 5-year return. Calculated for  2006-2100 but decadal anomalies begin in 2011. Error bars are +-1 standard deviation; standard deviation is calculated  from the 14 or 16 model values that represent the aggregated average over the regions, over the decades, and over  the ensemble members of each model. The average frequency for the historical reference period is 0.2 by definition and  the values in this graph should be interpreted with respect to a comparison with this historical average value. (Figure  source: Janssen et al. 201458). ","[0, 1, 1.0, 3.0]","[0, 1, 80, 240]","[0.09, 0.03, 0.09, 0.01, 2.0, 5.0]","[9, 3, 9, 1, 200, 500]",6.9949384,3.7416055,2.1259131,-4.0339103,-11.897109,5.3835526
859,"Figure 6.14 | Capacity factor effect on LCOE for estimated 2020 wave and tidal current  investment costs. The data point showing the EPRI conceptual design, using Pelamis 500  kW machines at 38% capacity factor, is based on Previsic (2004).","[0, 0, 1.0, 1.0]","[0, 0, 80, 80]","[0, 0, 0, 0, 2.0, 1.0]","[0, 0, 0, 0, 200, 100]",-4.8284006,-0.44969746,11.256852,-4.331873,7.073816,-16.692303
317,"Figure 2.6: Time evolution in effective radiative forcings (ERFs) across the industrial era for anthropogenic and natural  forcing mechanisms. The terms contributing to cumulative totals of positive and negative ERF are shown with colored  regions. The terms are labeled in order on the right-hand side with positive ERFs above the zero line and negative  ERFs below the zero line. The forcings from black-carbon-on-snow and contrail terms are grouped together into a  single term in the plot. Also shown are the cumulative sum of all forcings (Total; black dashed line) and of anthropo- genic-only forcings (Total Anthropogenic; red dashed line). Uncertainties in 2011 ERF values are shown in the original  figure (Myhre et al. 2013,8 Figure 8-18). See the Intergovernmental Panel on Climate Change Fifth Assessment Report  (IPCC AR5) Supplementary Material Table 8.SM.88for further information on the forcing time evolutions. Forcing num- bers are provided in Annex II of IPCC AR5. The total anthropogenic forcing was 0.57 (0.29 to 0.85) W/m2 in 1950, 1.25  (0.64 to 1.86) W/m2 in 1980, and 2.29 (1.13 to 3.33) W/m2 in 2011. (Figure source: Myhre et al. 2013,8 Figure 8-18; (c)  IPCC, used with permission).","[0, 1, 4.0, 5.0]","[0, 1, 320, 400]","[0.06, 0.01, 0.04, 0, 4.0, 12.0]","[6, 1, 4, 0, 400, 1200]",8.583154,-1.9908342,-7.454942,0.79589856,4.0624547,7.2295
502,"Figure 8.3: Trends in the annual number of large fires in the western United States for a variety of ecoregions. The  black lines are fitted trend lines. Statistically significant at a 10% level for all regions except the Snake Plain/Columbian  Plateau, Basin and Range, and Mediterranean California regions. (Figure source: Dennison et al.108).","[1, 1, 1.0, 1.0]","[1, 1, 80, 80]","[0.03, 0.01, 0.03, 0, 3.0, 3.0]","[3, 1, 3, 0, 300, 300]",-4.435053,0.6209095,6.740916,-2.0720372,-15.368517,13.1919775
447,"Figure 8.16 | Life cycle GHG emissions (excluding land use change) from a range of light  duty vehicle types as a function of the GHG emission intensity of electricity generation  systems using coal, natural gas or low-carbon technologies including nuclear and RE  (Samaras and Meisterling, 2008).","[0, 0, 1.0, 0]","[0, 0, 80, 0]","[0, 0.01, 0.01, 0, 3.0, 1.0]","[0, 1, 1, 0, 300, 100]",-6.01221,-5.602315,10.367595,-2.0978253,7.246805,-10.371943
1232,"Figure 3.10: Projections of anthropogenic CO2 uptake by process-based models. Six dynamic global vegetation models were run with IS92a CO2 concentrations as given in the SAR: (a) CO2 only, and (b) with these CO2 concentrations plus simulated climate changes obtained from the Hadley Centre climate model with CO2 and sulphate aerosol forcing from IS92a (Cramer et al., 2000). Panel (b) also shows the envelope of the results from panel (a) (in grey). (c) Ten process-based ocean carbon models were run with the same CO2 concentrations, assuming a constant climate (Orr and Dutay, 1999; Orr et al., 2000). A further six models were used to estimate the climate change impact on ocean CO2 uptake as a proportional change from the CO2-only case. The resulting changes were imposed on the mean trajectory of the simulations shown in panel (c), shown by the black line in panel (d), yielding the remaining trajectories in panel (d). The range of model results in panel (d) thus represents only the climate change impact on CO2 uptake; the range does not include the range of representations of ocean physical transport, which is depicted in panel (c).","[1, 0, 3.0, 3.0]","[1, 0, 240, 240]","[0.01, 0.04, 0.05, 0.02, 8.0, 10.0]","[1, 4, 5, 2, 800, 1000]",6.5958066,-1.9065589,-2.5791242,5.080454,-2.0158503,-3.0547676
1205,Figure 9.6: (a) The time evolution of the globally averaged temperature change relative to the years (1961 to 1990) of the SRES simulations A2 (top) and B2 (bottom) (Unit: degC). See Table 9.1 for more information on the individual models used here. (b) The time evolution of the globally averaged precipitation change relative to the years (1961 to 1990) of the SRES simulations A2 (top) and B2 (bottom) (Unit: %). See Table 9.1 for more information on the individual models used here.,"[0, 0, 2.0, 2.0]","[0, 0, 160, 160]","[0.06, 0, 0.02, 0.02, 6.0, 4.0]","[6, 0, 2, 2, 600, 400]",3.505762,-0.6436027,3.536628,3.1746607,2.9629834,11.699286
572,"Figure 9.1: Poleward migration, in degrees of latitude, of the location of annual mean tropical cyclone (TC) peak  lifetime intensity in the western North Pacific Ocean, after accounting for the known regional modes of interannual  (El Nino-Southern Oscillation; ENSO) and interdecadal (Pacific Decadal Oscillation; PDO) variability. The time series  shows residuals of the multivariate regression of annually averaged latitude of TC peak lifetime intensity onto the mean  Nino-3.4 and PDO indices. Data are taken from the Joint Typhoon Warning Center (JTWC). Shading shows 95% con- fidence bounds for the trend. Annotated values at lower right show the mean migration rate and its 95% confidence  interval in degrees per decade for the period 1945-2013. (Figure source: adapted from Kossin et al. 2016;13 (c) American  Meteorological Society. Used with permission.) ","[0, 2, 1.0, 2.0]","[0, 2, 80, 160]","[0.06, 0.01, 0.05, 0, 5.0, 3.0]","[6, 1, 5, 0, 500, 300]",3.6713848,4.450637,5.650703,2.3238275,-2.7881184,16.952536
2138,"Figure 10.10 | Carbon prices (in USD2005) as a function of global RE primary energy sup- ply (direct equivalent) in 2050. Colour coding is based on categories of atmospheric CO2  concentration level in 2100 (Fisher et al., 2007). Different symbols in the graph denote  the availability of CCS and nuclear energy. Note that limited nuclear scenarios include  nuclear phase-outs, constraints on the production of new nuclear and scenarios in which  nuclear production is constrained to baseline levels. For data reporting reasons, only 141  scenarios are included in the 2050 results shown here, as opposed to the full set of 164  scenarios. Figure and data adapted from Krey and Clarke (2011), modifi ed to include two  additional scenarios.","[2, 0, 0, 4.0]","[2, 0, 0, 320]","[0.01, 0, 0.06, 0, 3.0, 2.0]","[1, 0, 6, 0, 300, 200]",9.225503,4.653907,8.79483,-1.3480073,10.612797,-4.2982426
203,"Figure 7-5 | Summary of projected changes in crop yields, due to climate change over the 21st century. The figure includes projections for different emission scenarios, for  tropical and temperate regions, and for adaptation and no-adaptation cases combined. Relatively few studies have considered impacts on cropping systems for scenarios where  global mean temperatures increase by 4degC or more. For five timeframes in the near-term and long-term, data (n=1090) are plotted in the 20-year period on the horizontal axis  that includes the midpoint of each future projection period. Changes in crop yields are relative to late-20th-century levels. Data for each timeframe sum to 100%. Projections  taken from Abraha and Savage, 2006; Alexandrov and Hoogenboom, 2000; Arndt et al., 2011; Berg et al., 2013; Brassard and Singh, 2008; Brassard and Singh, 2007; Butt et al.,  2005; Calzadilla et al., 2009; Chhetri et al., 2010; Ciscar et al., 2011; Deryng et al., 2011; Giannakopoulos et al., 2009; Hermans et al., 2010; Iqbal et al., 2011; Izaurralde et al,  2005; Kim et al., 2010; Lal, 2011; Li et al., 2011; Lobell et al., 2008; Moriondo et al., 2010; Muller et al., 2010; Osborne et al., 2013; Peltonen-Sainio et al., 2011; Piao et al.,  2010; Ringler et al., 2010; Rowhanji et al., 2011; Schlenker and Roberts, 2009; Shuang-He et al., 2011; Southworth et al., 2000; Tan et al., 2010; Tao & Zhang, 2010; Tao and  Zhang, 2011; Tao et al., 2009; Thornton et al., 2009; Thornton et al., 2010; Thornton et al., 2011; Tingem and Rivington, 2009; Tingem et al., 2008; Walker and Schulze, 2008;  Wang et al., 2011; Xiong et al., 2007; Xiong et al., 2009.","[0, 1, 4.0, 2.0]","[0, 1, 320, 160]","[0.08, 0, 0.05, 0.05, 8.0, 2.0]","[8, 0, 5, 5, 800, 200]",5.2340474,-3.6228435,4.5300612,6.2714796,-9.7418,-4.159824
1100,"Figure 5.4 | Investment into mitigation up until 2030 and implications for  investments for four sustainable development dimensions. Cross-hatched bars show  the median investment in 1.5degC pathways across results from different models, and  solid bars for 2degC pathways, respectively. Whiskers on bars represent minima and  maxima across estimates from six models. Clean water and air pollution investments  are available only from one model. Mitigation investments show the change in  investments across mitigation options compared to the baseline. Negative mitigation  investments (grey bars) denote disinvestment (reduced investment needs) into  fossil fuel sectors compared to the baseline. Investments for different sustainable  development dimensions denote the investment needs for complementary measures  in order to avoid trade-offs (negative impacts) of mitigation. Negative sustainable  development investments for air pollution indicate cost savings, and thus synergies  of mitigation for air pollution control costs. The values compare to about 2 trillion  USD2010 (range of 1.4 to 3 trillion) of total energy-related investments in the 1.5degC  pathways. Source: Estimates from CD-LINKS scenarios summarised by McCollum et  al., 2018b.","[2, 0, 3.0, 5.0]","[2, 0, 240, 400]","[0.01, 0.03, 0.04, 0.04, 11.0, 6.0]","[1, 3, 4, 4, 1100, 600]",8.569051,-1.3921242,0.10303847,7.185329,11.553642,-8.654769
1925,"Figure 4.8. Sea ice extent anomalies (computed relative to the mean of the entire  period) for (a) the NH and (b) the SH, based on passive microwave satellite data.  Symbols indicate annual mean values while the smooth blue curves show decadal  variations (see Appendix 3.A). Linear trend lines are indicated for each hemisphere.  For the Arctic, the trend is -33 +- 7.4 x 103 km2 yr-1 (equivalent to approximately  -2.7% per decade), whereas the Antarctic results show a small positive trend of  5.6 +- 9.2 x 103 km2 yr-1. The negative trend in the NH is signifi cant at the 90% con- fi dence level whereas the small positive trend in the SH is not signifi cant (updated  from Comiso, 2003).","[2, 1, 0, 2.0]","[2, 1, 0, 160]","[0.04, 0.01, 0.07, 0, 12.0, 2.0]","[4, 1, 7, 0, 1200, 200]",7.207533,8.937274,1.9099497,8.439395,-10.409835,13.067247
1979,"Figure 4.12: July zonal mean increase in tropospheric O3 (ppb) as a function of latitude and altitude from Y2000 to Y2100 adopting SRES A2p projections for CH4, CO, VOC, and NOx. Results are shown for a sample of the chemistry-transport models (CTM) participating in IPCC OxComp workshop. Increases range from 0 to more than 80 ppb. Changes in the stratosphere (defined as O3 > 150 ppb in that model's Y2000 simulation) are masked off, as are also regions in the upper troposphere for some CTMs (UKMO, HGIS) where O3 is not explicitly calculated. See Table 4.10 for participating models.","[0, 0, 2.0, 3.0]","[0, 0, 160, 240]","[0.03, 0.01, 0.04, 0.02, 3.0, 1.0]","[3, 1, 4, 2, 300, 100]",6.324786,0.22846651,10.372789,-1.9800432,9.6988,3.7677162
324,"Figure 9.17: Simple model results: Temperature change (a) from 1990 to 2100 and (b) from 1990 to 2350, resulting from the five WRE  stabilisation profiles, using the simple climate model tuned to different AOGCMs as indicated on the bottom axis. (c) and (d) show the  corresponding results for the four S profiles. The underlying assumptions are the same as those for Figure 9.15. For comparison, temperature changes for the base scenario A1B are also shown in (a) and (c). ","[0, 0, 3.0, 1.0]","[0, 0, 240, 80]","[0, 0, 0.02, 0.01, 4.0, 2.0]","[0, 0, 2, 1, 400, 200]",2.2102034,-3.6858244,7.8872266,0.5967273,5.9799385,0.66316986
82,fig 23 private and publicsector investment in rd classified as basic applied and experimental development research for six african countries ranked in ascending order of gross national income left to right,"[0, 0, 1.0, 0]","[0, 0, 80, 0]","[0, 0, 0.02, 0, 4.0, 2.0]","[0, 0, 2, 0, 400, 200]",-5.9348135,-6.0148034,8.601078,0.80137426,14.611895,-10.418395
1439,"Figure 8.7: Global agricultural mitigation potential in 2030 from top-down models  by carbon price and stabilisation target Note: Dashed lines connect results from scenarios where tighter stabilization  targets were modelled with the same model and identical baseline characteriza- tion and mitigation technologies. From Chapter 3, Sections 3.3.5 and 3.6.2.  Source: Data assembled from USCCSP, 2006; Rose et al., 2007; Fawcett and Sands, 2006; Smith  and Wigley, 2006; Fujino et al., 2006; Kemfert et al., 2006.","[0, 0, 1.0, 1.0]","[0, 0, 80, 80]","[0.01, 0, 0, 0, 2.0, 3.0]","[1, 0, 0, 0, 200, 300]",-4.22243,0.24132487,6.8427644,-4.3122034,11.093964,-6.5289865
614,"Figure 4.4. Compendium of projected risks due to critical climate change impacts on ecosystems for different levels of global mean annual temperature rise, T, relative to pre-industrial climate (approach and event numbers as used in Table 4.1 and Appendix 4.1). It is important to note that these impacts do not take account of ancillary stresses on species due to over-harvesting, habitat destruction, landscape fragmentation, alien species invasions, fire regime change, pollution (such as nitrogen deposition), or for plants the potentially beneficial effects of rising atmospheric CO2. The red curve shows observed temperature anomalies for the period 1900-2005 (Brohan et al., 2006, see also Trenberth et al., 2007, Figure 3.6). The two grey curves provide examples of the possible future evolution of temperature against time (Meehl et al., 2007, Figure 10.4), providing examples of higher and lower trajectories for the future evolution of the expected value of mean responses to (i) the A2 emissions scenario and (ii) an extended B1 scenario, where radiative forcing beyond the year 2100 was kept constant to the 2100 value (all data from Meehl et al., 2007, Figure 10.4, see also Meehl et al., 2007, Section 10.7).","[1, 0, 1.0, 2.0]","[1, 0, 80, 160]","[0.04, 0.01, 0.05, 0.02, 10.0, 3.0]","[4, 1, 5, 2, 1000, 300]",3.672128,4.452728,2.5256832,7.629999,-2.000122,4.040494
2050,"Figure 2.4: Atmospheric concentrations of CO2 (top), CH4 (middle), and N2O (bottom) over the last 800,000 years (left  panels) and for 1750-2015 (right panels). Measurements are shown from ice cores (symbols with different colors for  different studies) and for direct atmospheric measurements (red lines). (Adapted from IPCC 2007,88 Figure SPM.1,  (c) IPCC, used with permission; data are from https://www.epa.gov/climate-indicators/climate-change-indicators-atmo- spheric-concentrations-greenhouse-gases). ","[0, 0, 2.0, 1.0]","[0, 0, 160, 80]","[0.01, 0, 0, 0, 4.0, 9.0]","[1, 0, 0, 0, 400, 900]",0.08708764,-2.9574285,-4.518207,-0.76432294,1.6153784,-1.8218912
433,"Figure 11.5: Time series of annual mean permafrost temperatures (units: degF) at various depths from 39 to 65 feet (12 to  20 meters) from 1977 through 2015 at several sites across Alaska, including the North Slope continuous permafrost re- gion (purple/blue/green shades), and the discontinuous permafrost (orange/pink/red shades) in Alaska and northwest- ern Canada. Solid lines represent the linear trends drawn to highlight that permafrost temperatures are warming faster  in the colder, coastal permafrost regions than the warmer interior regions. (Figure Source: adapted from Romanovsky  et al. 2016;175 (c) American Meteorological Society, used with permission.)","[1, 0, 1.0, 1.0]","[1, 0, 80, 80]","[0.04, 0, 0.03, 0, 2.0, 3.0]","[4, 0, 3, 0, 200, 300]",-4.5048823,0.6826896,6.5209346,-4.2835965,-13.216246,14.228589
610,"Figure 3.38: Relationship between global mean equilibrium temperature change and stabilization concentration of greenhouse gases using: (i) 'best estimate' climate sensitivity  of 3degC (black), (ii) upper boundary of likely range of climate sensitivity of 4.5degC (red), (iii) lower boundary of likely range of climate sensitivity of 2degC (blue) (see also Table 3.9). ","[0, 0, 1.0, 0]","[0, 0, 80, 0]","[0.01, 0.02, 0.02, 0, 3.0, 5.0]","[1, 2, 2, 0, 300, 500]",-6.01221,-5.602315,2.148366,-2.339687,4.914001,-2.4728258
2271,"Figure 3.4. (a) Annual anomalies of global SST (HadSST2; red bars and blue solid curve), 1850 to 2005, and global NMAT (HadMAT, green curve), 1856 to 2005, relative to  the 1961 to 1990 mean (degC) from the UK Meteorological Offi ce (UKMO; Rayner et al., 2006). The smooth curves show decadal variations (see Appendix 3.A). The dashed black  curve shows equivalent smoothed SST anomalies from the TAR. (b) Smoothed annual global SST anomalies, relative to 1961 to 1990 (degC), from HadSST2 (blue line, as in (a)),  from NCDC (Smith et al., 2005; red line) and from COBE-SST (Ishii et al., 2005; green line). The latter two series begin later in the 19th century than HadSST2. (c,d) As in (a) but  for the NH and SH showing only the UKMO series.","[1, 0, 1.0, 3.0]","[1, 0, 80, 240]","[0.07, 0.03, 0.03, 0, 6.0, 15.0]","[7, 3, 3, 0, 600, 1500]",6.9950285,3.7411203,-8.444621,2.6457624,-6.7936378,16.587383
407,"Figure 3.22 | Regional temperature scaling with carbon dioxide (CO2) concentration (ppm) from 1850 to 2099 for two different regions defined in the Special Report on  Managing the Risks of Extreme Events and Disasters to Advance Climate Change Adaptation (SREX) for central Europe (CEU) (a) and central North America (CNA) (b). Solid  lines correspond to the regional average annual maximum daytime temperature (TXx) anomaly, and dashed lines correspond to the global mean temperature anomaly, where  all temperature anomalies are relative to 1850-1870 and units are degrees Celsius. The black line in all panels denotes the three-member control ensemble mean, with the grey  shaded regions corresponding to the ensemble range. The coloured lines represent the three-member ensemble means of the experiments corresponding to albedo +0.02 (cyan),  albedo +0.04 (purple), albedo + 0.08 (orange), albedo +0.10 (red), irrigation (blue), and irrigation with albedo +0.10 (green). Adapted from Hirsch et al. (2017). ","[3, 0, 0, 2.0]","[3, 0, 0, 160]","[0.06, 0.04, 0.08, 0, 6.0, 15.0]","[6, 4, 8, 0, 600, 1500]",7.332192,9.124471,-8.444622,2.645986,-4.014621,3.3261359
