imageid,text,l1_l4_vector_unweighted,l1_l4_vector_weighted,keyword_vector_unweighted,keyword_vector_weighted,lx,ly,kx,ky,sx,sy
758,"Figure 2.16 | Electricity generation for the four illustrative pathway archetypes plus the IEA's Faster Transition Scenario (IEA, 2017d) (panel a), and their  relative location in the ranges for pathways limiting warming to 1.5degC with no or limited overshoot (panel b). The category 'Other renewables' includes electricity  generation not covered by the other categories, for example, hydro and geothermal. The number of pathways that have higher primary energy than the scale in the bottom panel  are indicated by the numbers above the whiskers. Black horizontal dashed lines indicate the level of primary energy supply in 2015 (IEA, 2017e). Box plots in the lower panel show  the minimum-maximum range (whiskers), interquartile range (box), and median (vertical thin black line). Symbols in the lower panel show the four pathway archetypes - S1 (white  square), S2 (yellow square), S5 (black square), LED (white disc) - as well as the IEA's Faster Transition Scenario (red disc). Pathways with no or limited overshoot included the Below- 1.5degC and 1.5degC-low-OS classes. ","[4, 1, 1.0, 1.0]","[4, 1, 80, 80]","[0, 0.03, 0.07, 0, 6.0, 25.0]","[0, 3, 7, 0, 600, 2500]",-5.2924905,0.5574489,-10.285775,4.7110786,11.437459,-13.921256
2117,"Figure 9.28: Decadal probability density functions (PDF) of the ECHAM3/LSG transient greenhouse gas ensemble: each PDF (greyscale bars) consists of 160 NAO index realisations including the monthly means of November to February of the four simulations over one decade. The greyscale background indicates the relative frequency of the classified NAO indices based on a kernel function (Matyasovszky, 1998). The PDF's width indicates the decadal variability. At the bottom, the time-series of the decadal mean (solid green line) and the variability (solid red line) of each PDF as well as the corresponding linear trends (dashed lines) are shown (from Paeth et al., 1999).","[2, 2, 0, 0]","[2, 2, 0, 0]","[0.05, 0.01, 0.07, 0.01, 5.0, 11.0]","[5, 1, 7, 1, 500, 1100]",-10.277158,-5.1841493,-6.4361715,0.99013484,-9.119826,0.522836
1947,"Figure 10.18. Changes in extremes based on multi-model simulations from nine global coupled climate models, adapted from Tebaldi et al. (2006). (a) Globally averaged  changes in precipitation intensity (defi ned as the annual total precipitation divided by the number of wet days) for a low (SRES B1), middle (SRES A1B) and high (SRES A2)  scenario. (b) Changes in spatial patterns of simulated precipitation intensity between two 20-year means (2080-2099 minus 1980-1999) for the A1B scenario. (c) Globally aver- aged changes in dry days (defi ned as the annual maximum number of consecutive dry days). (d) Changes in spatial patterns of simulated dry days between two 20-year means  (2080-2099 minus 1980-1999) for the A1B scenario. Solid lines in (a) and (c) are the 10-year smoothed multi-model ensemble means; the envelope indicates the ensemble  mean standard deviation. Stippling in (b) and (d) denotes areas where at least fi ve of the nine models concur in determining that the change is statistically signifi cant. Extreme  indices are calculated only over land following Frich et al. (2002). Each model's time series was centred on its 1980 to 1999 average and normalised (rescaled) by its standard  deviation computed (after de-trending) over the period 1960 to 2099. The models were then aggregated into an ensemble average, both at the global and at the grid-box level.  Thus, changes are given in units of standard deviations.","[1, 5, 4.0, 1.0]","[1, 5, 320, 80]","[0.12, 0.03, 0.17, 0.01, 16.0, 7.0]","[12, 3, 17, 1, 1600, 700]",3.8851388,-4.0994797,-1.3204021,8.278214,-10.127674,4.733205
304,"Figure 3.21 | The dependence of risks and/or impacts associated with the Reasons for Concern (RFCs) on the level of climate change, updated and adapted from WGII AR5  Ch 19, Figure 19.4 and highlighting the nature of this dependence between 0degC and 2degC warming above pre-industrial levels. As in the AR5, literature was used to make  expert judgements to assess the levels of global warming at which levels of impact and/or risk are undetectable (white), moderate (yellow), high (red) or very high (purple).  The colour scheme thus indicates the additional risks due to climate change. The transition from red to purple, introduced for the first time in AR4, is defined by very high risk  of severe impacts and the presence of significant irreversibility, or persistence of climate-related hazards combined with a limited ability to adapt due to the nature of the  hazard or impact. Comparison of the increase of risk across RFCs indicates the relative sensitivity of RFCs to increases in GMST. As was done previously, this assessment takes  autonomous adaptation into account, as well as limits to adaptation (RFC 1, 3, 5) independently of development pathway. The rate and timing of impacts were taken into  account in assessing RFC 1 and 5. The levels of risk illustrated reflect the judgements of the Ch 3 authors. RFC1 Unique and threatened systems: ecological and human  systems that have restricted geographic ranges constrained by climate related conditions and have high endemism or other distinctive properties. Examples include coral reefs,  the Arctic and its indigenous people, mountain glaciers and biodiversity hotspots. RFC2 Extreme weather events: risks/impacts to human health, livelihoods, assets and  ecosystems from extreme weather events such as heatwaves, heavy rain, drought and associated wildfires, and coastal flooding. RFC3 Distribution of impacts: risks/impacts  that disproportionately affect particular groups due to uneven distribution of physical climate change hazards, exposure or vulnerability. RFC4 Global aggregate impacts:  global monetary damage, global scale degradation and loss of ecosystems and biodiversity. RFC5 Large-scale singular events: are relatively large, abrupt and sometimes  irreversible changes in systems that are caused by global warming. Examples include disintegration of the Greenland and Antarctic ice sheets. The grey bar represents the range  of GMST for the most recent decade: 2006-2015.","[3, 0, 3.0, 10.0]","[3, 0, 240, 800]","[0.08, 0.02, 0.06, 0.01, 32.0, 9.0]","[8, 2, 6, 1, 3200, 900]",9.993608,-0.3561639,-2.3234067,9.157281,-2.2182767,3.3112352
2018,"Figure 1.1: This image shows observations globally from nine different variables that are key indicators of a warming  climate. The indicators (listed below) all show long-term trends that are consistent with global warming. In parentheses  are the number of datasets shown in each graph, the length of time covered by the combined datasets and their anomaly  reference period (where applicable), and the direction of the trend: land surface air temperature (4 datasets, 1850-2016  relative to 1976-2005, increase); sea surface temperature (3 datasets, 1850-2016 relative to 1976-2005, increase);  sea level (4 datasets, 1880-2014 relative to 1996-2005, increase); tropospheric temperature (5 datasets, 1958-2016  relative to 1981-2005, increase); ocean heat content, upper 700m (5 datasets, 1950-2016 relative to 1996-2005, in- crease); specific humidity (4 datasets, 1973-2016 relative to 1980-2003, increase); Northern Hemisphere snow cover,  March-April and annual (1 dataset, 1967-2016 relative to 1976-2005, decrease); arctic sea ice extent, September and  annual (1 dataset, 1979-2016, decrease); glacier cumulative mass balance (1 dataset, 1980-2016, decrease). More  information on the datasets can be found in the accompanying metadata. (Figure source: NOAA NCEI and CICS-NC,  updated from Melillo et al. 2014;144 Blunden and Arndt 201615).","[1, 0, 1.0, 3.0]","[1, 0, 80, 240]","[0.07, 0.01, 0.05, 0.01, 19.0, 2.0]","[7, 1, 5, 1, 1900, 200]",6.995023,3.7408938,-0.40571016,8.977411,-3.8977718,8.407649
196,"Figure 1.8 | Decomposition of the change in total annual carbon dioxide (CO2) emissions from fossil fuel combustion by decade and four driving factors: population, income (gross  domestic product, GDP) per capita, energy intensity of GDP and carbon intensity of energy. The bar segments show the changes associated with each individual factor, holding the  respective other factors constant. Total emission changes are indicated by a triangle. The change in emissions over each decade is measured in gigatonnes of CO2 per year (GtCO2/yr);  income is converted into common units, using purchasing power parities. {WGIII SPM.3}","[3, 0, 1.0, 1.0]","[3, 0, 80, 80]","[0.07, 0, 0.05, 0, 7.0, 2.0]","[7, 0, 5, 0, 700, 200]",-5.4253836,0.095442094,5.265843,5.4300694,4.298134,-8.170074
2071,"Figure 2.3. Recent CO2 concentrations and emissions. (a) CO2 concentrations  (monthly averages) measured by continuous analysers over the period 1970 to  2005 from Mauna Loa, Hawaii (19degN, black; Keeling and Whorf, 2005) and Baring  Head, New Zealand (41degS, blue; following techniques by Manning et al., 1997). Due  to the larger amount of terrestrial biosphere in the NH, seasonal cycles in CO2 are  larger there than in the SH. In the lower right of the panel, atmospheric oxygen (O2)  measurements from fl ask samples are shown from Alert, Canada (82degN, pink) and  Cape Grim, Australia (41degS, cyan) (Manning and Keeling, 2006). The O2 concentration  is measured as 'per meg' deviations in the O2/N2 ratio from an arbitrary reference,  analogous to the 'per mil' unit typically used in stable isotope work, but where the ra- tio is multiplied by 106 instead of 103 because much smaller changes are measured.  (b) Annual global CO2 emissions from fossil fuel burning and cement manufacture  in GtC yr-1 (black) through 2005, using data from the CDIAC website (Marland et al,  2006) to 2003. Emissions data for 2004 and 2005 are extrapolated from CDIAC using  data from the BP Statistical Review of World Energy (BP, 2006). Land use emissions  are not shown; these are estimated to be between 0.5 and 2.7 GtC yr-1 for the 1990s  (Table 7.2). Annual averages of the 13C/12C ratio measured in atmospheric CO2 at  Mauna Loa from 1981 to 2002 (red) are also shown (Keeling et al, 2005). The isotope  data are expressed as d13C(CO2) %0 (per mil) deviation from a calibration standard.  Note that this scale is inverted to improve clarity. ","[1, 2, 3.0, 4.0]","[1, 2, 240, 320]","[0.07, 0.02, 0.07, 0, 2.0, 8.0]","[7, 2, 7, 0, 200, 800]",7.8245177,-1.3972794,-3.8124034,-3.1323526,1.5424999,-6.4380693
497,"Figure 8.1 CO2 transport costs range for onshore and offshore pipelines per 250 km, 'normal' terrain conditions. The figure shows low (solid  lines) and high ranges (dotted lines). Data based on various sources (for details see Chapter 4).","[2, 0, 0, 1.0]","[2, 0, 0, 80]","[0, 0.02, 0.01, 0, 1.0, 4.0]","[0, 2, 1, 0, 100, 400]",-14.292062,-1.5714186,4.5358863,-5.5133667,0.7445051,-10.587696
220,"Figure 6.15 Estimated volume of pH perturbations at global scale for hypothetical examples in which injection of CO2 into the ocean interior  provides 100% or 10% of the mitigation effort needed to move from a logistic emissions curve cumulatively releasing 18,000 GtCO2 (=5000  GtC) to emissions consistent with atmospheric CO2 stabilization at 550 ppm according to the WRE550 pathway (Wigley et al., 1996). The curves  show the simulated fraction of ocean volume with a pH reduction greater than the amount shown on the horizontal axis. For the 10% case, in year  2100, injection rates are high and about1% of the ocean volume has significant pH reductions; in year 2300, injection rates are low, but previously  injected CO2 has decreased ocean pH by about 0.1 unit below the value produced by a WRE550 atmospheric CO2 pathway in the absence of CO2  release directly to the ocean (Caldeira and Wickett, 2005).","[0, 1, 1.0, 1.0]","[0, 1, 80, 80]","[0.03, 0, 0.03, 0, 10.0, 3.0]","[3, 0, 3, 0, 1000, 300]",-4.810134,0.15163687,2.3574483,7.2734513,-1.6308153,-9.008691
1225,"Figure 5.24 The produced water chemistry before CO2 injection and the produced water chemistry after 12 months and 31 months of injection  at Weyburn has been contoured from fluid samples taken at various production wells. The black dots show the location of the sample wells:  (a) d13CHCO3 in the produced water, showing the effect of supercritical CO2 dissolution and mineral reaction. (b) Calcium concentrations in the  produced water, showing the result of mineral dissolution (after Perkins et al., 2005).","[1, 0, 2.0, 0]","[1, 0, 160, 0]","[0.01, 0, 0.01, 0, 1.0, 2.0]","[1, 0, 1, 0, 100, 200]",-2.410563,-5.061235,9.114562,-6.167139,-4.2117743,-7.88446
1294,"Figure 9.10. Observed and hindcast decadal mean surface temperature anomalies (degC) expressed, for each decade, relative to the preceding three decades. Observed  anomalies are represented by horizontal black lines. Hindcast decadal anomalies and their uncertainties (5 to 95% confi dence bounds) are displayed as vertical bars. Hindcasts  are based on a Bayesian detection analysis using the estimated response to historical external forcing. Hindcasts made with CGCM2, HadCM2 (see Table 8.1 of the TAR) and  HadCM3 (see Table 8.1, this report) use the estimated response to anthropogenic forcing only (left hand column of legend) while those made with selected MMD 20C3M  models used anthropogenic and natural forcings (centre column of legend; see Table 8.1 for model descriptions). Hindcasts made with the ensemble mean of the selected  20C3M models are indicated by the thick green line. A hindcast based on persisting anomalies from the previous decade is also shown. The hindcasts agree well with  observations from the 1950s onward. Hindcasts for the decades of the 1930s and 1940s are sensitive to the details of the hindcast procedure. A forecast for the decadal global  mean anomaly for the decade 2000 to 2009, relative to the 1970 to 1999 climatology, based on simulations performed with the Canadian Centre for Climate Modelling and  Analysis Coupled Global Climate Model (CGCM2) is also displayed. From Lee et al. (2006).","[5, 1, 2.0, 3.0]","[5, 1, 160, 240]","[0.09, 0.06, 0.05, 0.03, 3.0, 12.0]","[9, 6, 5, 3, 300, 1200]",6.325531,0.2289099,-7.835333,0.11291571,2.6517067,9.137505
1803,"Figure 3.2: Observed global mean temperature trend (black bar) and attributable warming or cooling influences of  anthropogenic and natural forcings over 1951-2010. Observations are from HadCRUT4, along with observational un- certainty (5% to 95%) error bars.62 Likely ranges (bar-whisker plots) and midpoint values (colored bars) for attributable  forcings are from IPCC AR5.1. GHG refers to well-mixed greenhouse gases, OA to other anthropogenic forcings, NAT  to natural forcings, and ANT to all anthropogenic forcings combined. Likely ranges are broader for contributions from  well-mixed greenhouse gases and for other anthropogenic forcings, assessed separately, than for the contributions  from all anthropogenic forcings combined, as it is more difficult to quantitatively constrain the separate contributions of  the various anthropogenic forcing agents. (Figure source: redrawn from Bindoff et al.;1 (c) IPCC. Used with permission.)","[2, 0, 0, 4.0]","[2, 0, 0, 320]","[0.03, 0.02, 0.02, 0.02, 5.0, 5.0]","[3, 2, 2, 2, 500, 500]",9.225503,4.653907,2.0976505,1.2929314,5.856314,7.2644506
2253,"Figure 8.12: An uncertainty ratio for 10-degree latitude bands; (a) control simulations; (b) difference between the control and doubled greenhouse gas simulations. E is evaporation, P is precipitation, Tscr is screen temperature, cld is the percentage cloud cover and Sn is the net short-wave radiation at the surface. The units on the Y-axis are dimensionless. An asterisk means the value is statistically significant at 95% and a diamond at 90% (see Crossley et al., 2000).","[3, 0, 1.0, 0]","[3, 0, 80, 0]","[0.01, 0.01, 0.03, 0.02, 2.0, 1.0]","[1, 1, 3, 2, 200, 100]",-5.297502,-5.6647835,10.654255,-4.4509273,-4.7576513,-1.0308552
2025,"Figure 2.6 | Annual global emissions characteristics for 2020, 2030, 2050, 2100. Data are shown for (a) Kyoto-GHG emissions, and (b) global total CO2 emissions,  (c) CO2 emissions from the agriculture, forestry and other land use (AFOLU) sector, (d) global N2O emissions, and (e) CO2 emissions from fossil fuel use and industrial processes.  The latter is also split into (f) emissions from the energy supply sector (electricity sector and refineries) and (g) direct emissions from fossil-fuel use in energy demand sectors  (industry, buildings, transport) (bottom row). Horizontal black lines show the median, boxes show the interquartile range, and whiskers the minimum-maximum range. Icons  indicate the four pathway archetypes used in this chapter. In case less than seven data points are available in a class, the minimum-maximum range and single data points  are shown. Kyoto-GHG, emissions in the top panel are aggregated with AR4 GWP-100 and contain CO2, CH4, N2O, HFCs, PFCs, and SF6. NF3 is typically not reported by IAMs.  Scenarios with year-2010 Kyoto-GHG emissions outside the range assessed by IPCC AR5 WGIII assessed are excluded (IPCC, 2014b).","[4, 1, 0, 3.0]","[4, 1, 0, 240]","[0.07, 0.04, 0.08, 0, 1.0, 9.0]","[7, 4, 8, 0, 100, 900]",8.317803,5.970453,-6.087664,-2.7365403,7.000128,-9.130804
1838,"Figure 2.8. Estimates used to evaluate trends in weighted global average OH concentrations. (A) and (B): comparison of 1980 to 1999 OH anomalies (relative to their long- term means) inferred by Bousquet et al. (2005), Prinn et al. (2001) and Krol et al. (2003) from AGAGE methyl chloroform observations, and by Bousquet et al. (2005) when methyl  chloroform emissions as well as OH are inferred; error bars for Bousquet et al. (2005) refer to 1 standard deviation inversion errors while yellow areas refer to the envelope of  their 18 OH inversions. (C) OH concentrations for 1979 to 2003 inferred by Prinn et al. (2005a) (utilising industry emissions corrected using recent methyl chloroform observa- tions), showing the recovery of 2003 OH levels to 1979 levels; also shown are results assuming uncorrected emissions and estimates of recent oceanic re-emissions. Error bars  in Prinn et al. (2001, 2005a) are 1 standard deviation and include inversion, model, emission and calibration errors from large Monte Carlo ensembles (see Section 2.3.5 for  details and references).","[2, 0, 0, 2.0]","[2, 0, 0, 160]","[0.01, 0.05, 0.02, 0.02, 2.0, 3.0]","[1, 5, 2, 2, 200, 300]",6.9212265,8.794835,6.8422437,-4.3122797,-4.146845,-4.5283756
1911,"Figure 11-7 | Illustrative co-benefits comparison of the health and climate  cost-effectiveness of selected household, transport, and power sector interventions  (Smith and Haigler, 2008). Area of each circle denotes the total social benefit in  international dollars (Int$) from the combined value of carbon offsets (valued at  10$/tCO2-eq (tons of carbon dioxide equivalent)) and averted disability-adjusted life  years (DALYs; $7450/DALY, which is representative of valuing each DALY at the  average world gross domestic product (PPP) per capita in 2000). The vertical lines  shows the range of the cut offs for cost-effective (solid lines) and very cost-effective  (dashed lines) health interventions in India (red lines) and China (purple lines) using  the WHO CHOICE (CHOosing Interventions that are Cost-Effective) criteria (WHO,  2003). This figure evaluates only a small subset of all co-benefits opportunities, and  thus should not be considered either current or complete. It does illustrate, however,  the kind of comparisons that can help distinguish and prioritize options. Note that  even with the log-log scaling, there are big differences among them. For other figures  comparing the climate and health benefits of co-benefits actions including those in  food supply and urban design, see Haines et al. (2009). See the original reference for  details of the calculations in this figure (Smith and Haigler, 2008).","[3, 0, 3.0, 2.0]","[3, 0, 240, 160]","[0.03, 0.01, 0.08, 0.02, 2.0, 14.0]","[3, 1, 8, 2, 200, 1400]",4.4275775,-2.5342138,-9.016428,0.5112946,16.8078,-8.557118
2252,"Figure 9.9. Estimated contribution from greenhouse gas (red), other anthropogenic  (green) and natural (blue) components to observed global mean surface temperature  changes, based on 'optimal' detection analyses (Appendix 9.A). (a) 5 to 95%  uncertainty limits on scaling factors (dimensionless) based on an analysis over  the 20th century, (b) the estimated contribution of forced changes to temperature  changes over the 20th century, expressed as the difference between 1990 to 1999  mean temperature and 1900 to 1909 mean temperature (degC) and (c) estimated  contribution to temperature trends over 1950 to 1999 (degC per 50 years). The  horizontal black lines in (b) and (c) show the observed temperature changes from  the Hadley Centre/Climatic Research Unit gridded surface temperature data set  (HadCRUT2v; Parker et al., 2004). The results of full space-time optimal detection  analyses (Nozawa et al., 2005; Stott et al., 2006c) using a total least squares  algorithm (Allen and Stott, 2003) from ensembles of simulations containing each  set of forcings separately are shown for four models, MIROC3.2(medres), PCM,  UKMO-HadCM3 and GFDL-R30. Also shown, labelled 'EIV', is an optimal detection  analysis using the combined spatio-temporal patterns of response from three models  (PCM, UKMO-HadCM3 and GFDL-R30) for each of the three forcings separately, thus  incorporating inter-model uncertainty (Huntingford et al., 2006).","[0, 1, 2.0, 2.0]","[0, 1, 160, 160]","[0.06, 0.02, 0.08, 0.01, 12.0, 6.0]","[6, 2, 8, 1, 1200, 600]",2.945688,-0.08714062,-0.19409202,7.5424514,-2.5400124,6.5049033
2289,"Figure 1.7. Plotted are the frequencies of the correlation coefficients (associations) between the timing of changes in traits (e.g., earlier egg- laying) of 145 species and modelled (HadCM3) spring temperatures for the grid-boxes in which each species was examined. At each location, all of which are in the Northern Hemisphere, the changing trait is compared with modelled temperatures driven by: (a) natural forcings (purple bars), (b) anthropogenic (i.e., human) forcings (orange bars), and (c) combined natural and anthropogenic forcings (yellow bars). In addition, on each panel the frequencies of the correlation coefficients between the actual temperatures recorded during each study and changes in the traits of 83 species, the only ones of the 145 with reported local-temperature trends, are shown (dark blue bars). On average the number of years that species were examined is about 28, with average starting and ending years of 1960 and 1998. Note that the agreement: (a) between the natural and actual plots is weaker (K = 60.16) than (b) between the anthropogenic and actual (K = 35.15), which in turn is weaker than( c) the agreement between combined and actual (K = 3.65). Taken together, these plots show that a measurable portion of the warming regional temperatures to which species are reacting can be attributed to humans, therefore showing joint attribution (after Root et al., 2005).","[2, 2, 2.0, 0]","[2, 2, 160, 0]","[0.05, 0, 0.09, 0.01, 4.0, 12.0]","[5, 0, 9, 1, 400, 1200]",-2.4106376,-5.061268,-7.454679,0.7958759,-1.4651853,8.346181
1751,"Figure 10.17. (a) Multi-model mean of the regression of the leading EOF of ensemble mean Northern Hemisphere sea level pressure (NH SLP, thin red line). The time series of  regression coeffi cients has zero mean between year 1900 and 1970. The thick red line is a 10-year low-pass fi ltered version of the mean. The grey shading represents the inter- model spread at the 95% confi dence level and is fi ltered. A fi ltered version of the observed SLP from the Hadley Centre (HadSLP1) is shown in black. The regression coeffi cient  for the winter following a major tropical eruption is marked by red, blue and black triangles for the multi-model mean, the individual model mean and observations, respectively.  (b) As in (a) for Southern Hemisphere SLP for models with (red) and without (blue) ozone forcing. Adapted from Miller et al. (2006).","[5, 2, 0, 1.0]","[5, 2, 0, 80]","[0.03, 0, 0.12, 0.01, 1.0, 14.0]","[3, 0, 12, 1, 100, 1400]",-13.252251,-1.5483851,-9.378439,-0.008039462,-6.769791,6.4953923
492,"Figure 4.2. Net carbon exchange of all terrestrial ecosystems as simulated by the DGVM LPJ (Sitch et al., 2003; Gerten et al., 2004 - negative values mean a carbon sink, positive values carbon losses to the atmosphere). Past century data are based on observations and climate model data were normalised to be in accord with these observations for the 1961-1990 data (CRU-PIK). Transient future projections are for the SRES A2 and B1 emissions scenarios (Naki 'cenovi 'c et al., 2000), forcing the climate models HadCM3 and ECHAM5, respectively (cf. Lucht et al., 2006; Schaphoff et al., 2006). In contrast to previous global projections (Prentice et al., 2001 - Figure 3.10), the world's ecosystems sink service saturates earlier (about 2030) and the terrestrial biosphere tends to become a carbon source earlier (about 2070) and more consistently, corroborating other projections of increased forcing from biogenic terrestrial sources (e.g., Cox et al., 2000, 2004; White et al., 2000a; Lucht et al., 2006; Schaphoff et al., 2006; Scholze et al., 2006; see Figure 4.3 for maps on underlying ecosystem changes). Note that these projections assume an effective CO2-fertilisation (see Section 4.4.1).","[0, 1, 0, 4.0]","[0, 1, 0, 320]","[0.02, 0, 0.03, 0.07, 6.0, 1.0]","[2, 0, 3, 7, 600, 100]",9.225633,4.6537867,7.0844855,4.4340982,-1.3532985,1.988475
